Book Id,Title,Author,Author l-f,Additional Authors,ISBN,ISBN13,My Rating,Average Rating,Publisher,Binding,Number of Pages,Year Published,Original Publication Year,Date Read,Date Added,Bookshelves,Bookshelves with positions,Exclusive Shelf,My Review,Spoiler,Private Notes,Read Count,Recommended For,Recommended By,Owned Copies,Original Purchase Date,Original Purchase Location,Condition,Condition Description,BCID
58684962,Getting Started with Streamlit for Data Science: Create and deploy Streamlit web applications from scratch in Python,Tyler Richards,"Richards, Tyler",,"=""180056550X""","=""9781800565500""",0,4.50,,Paperback,,2021,,,2021/09/28,to-read,to-read (#54),to-read,,,,0,,,0,,,,,
43084343,Machine Learning for Healthcare Analytics Projects: Build smart AI applications using neural network methodologies across the healthcare vertical market,Eduonix Learning Solutions,"Solutions, Eduonix Learning",,"=""""","=""""",0,0.0,Packt Publishing,Kindle Edition,134,2018,,,2021/09/27,to-read,to-read (#53),to-read,,,,0,,,0,,,,,
8247775,The Little Book That Still Beats the Market,Joel Greenblatt,"Greenblatt, Joel",,"=""0470624159""","=""9780470624159""",0,4.04,Wiley,Hardcover,208,2010,2007,,2021/09/27,to-read,to-read (#52),to-read,,,,0,,,0,,,,,
56291781,Hands-On Gradient Boosting with XGBoost and scikit-learn: Perform accessible machine learning and extreme gradient boosting with Python,Corey Wade,"Wade, Corey",Kevin Glynn,"=""""","=""""",5,4.50,,Kindle Edition,,2020,,2021/09/20,2021/09/20,,,read,"The book delivers exactly what it said: a hands-on approach to XGBoost. I really enjoy the fact that the book focus in the hyperparameter tuning.<br/>For me it is a 4.5 I deduct 0.5 because I was hoping that the difference between XGBoost and Gradient boosting would be more clearly explained. I had to use some external resource to understand it better. Nonetheless, as a hands-on book, it delivers what is supposes to",,,2,,,0,,,,,
41573140,"Hands-On Recommendation Systems with Python: Start building powerful and personalized, recommendation engines with Python",Rounak Banik,"Banik, Rounak",,"=""1788993756""","=""9781788993753""",0,3.86,Packt Publishing,Paperback,146,2018,,,2021/09/20,to-read,to-read (#51),to-read,,,,0,,,0,,,,,
4865,How to Win Friends and Influence People,Dale Carnegie,"Carnegie, Dale","ریحانه جعفری, پروین قائمی","=""""","=""""",3,4.21,Gallery Books,Paperback,288,1998,1936,2020/01/01,2017/10/26,,,read,,,,1,,,0,,,,,
18077903,"Creativity, Inc.: Overcoming the Unseen Forces That Stand in the Way of True Inspiration",Ed Catmull,"Catmull, Ed",Amy    Wallace,"=""0812993012""","=""9780812993011""",4,4.19,Random House,Hardcover,368,2014,2009,2021/09/03,2021/05/09,,,read,,,,1,,,0,,,,,
14321030,Best Practices in Data Cleaning: A Complete Guide to Everything You Need to Do Before and After Collecting Your Data,Jason W. Osborne,"Osborne, Jason W.",,"=""1412988012""","=""9781412988018""",0,4.05,"Sage Publications, Inc",Paperback,275,2012,2012,,2021/09/01,to-read,to-read (#50),to-read,,,,0,,,0,,,,,
15808128,Bad Data Handbook: Cleaning Up The Data So You Can Get Back To Work,Q. Ethan McCallum,"McCallum, Q. Ethan",,"=""1449321887""","=""9781449321888""",0,3.52,O'Reilly Media,Paperback,264,2012,2012,,2021/09/01,to-read,to-read (#49),to-read,,,,0,,,0,,,,,
29331954,Make: Drones: Teach an Arduino to Fly,David McGriffy,"McGriffy, David",,"=""1680451715""","=""9781680451719""",0,3.87,"Maker Media, Inc",Paperback,242,2016,,,2021/08/31,to-read,to-read (#48),to-read,,,,0,,,0,,,,,
30462852,"Computer Age Statistical Inference: Algorithms, Evidence, and Data Science",Bradley Efron,"Efron, Bradley",Trevor Hastie,"=""1107149894""","=""9781107149892""",0,4.40,Cambridge University Press,Hardcover,495,2016,,,2021/08/31,to-read,to-read (#47),to-read,,,,0,,,0,,,,,
43247984,Python for Finance: Mastering Data-Driven Finance,Yves Hilpisch,"Hilpisch, Yves",,"=""""","=""""",0,3.57,O'Reilly Media,Kindle Edition,722,2018,,,2021/08/27,to-read,to-read (#46),to-read,,,,0,,,0,,,,,
781182,Barbarians at the Gate: The Fall of RJR Nabisco,Bryan Burrough,"Burrough, Bryan",John Helyar,"=""0060536357""","=""9780060536350""",0,4.24,HarperBus,Paperback,592,2005,1989,,2021/08/21,to-read,to-read (#45),to-read,,,,0,,,0,,,,,
50542108,Deep Learning for Vision Systems,Mohamed Elgendy,"Elgendy, Mohamed",,"=""1617296198""","=""9781617296192""",5,4.25,Manning,Paperback,480,2020,,2021/08/18,2021/08/11,,,read,Great book if you are a beginner in the field. The concepts are explained very nicely. It has the best explanation of image segmentation of all the book I have read,,,1,,,0,,,,,
54855814,"Machine Learning for Algorithmic Trading: Predictive models to extract signals from market and alternative data for systematic trading strategies with Python, 2nd Edition",Stefan Jansen,"Jansen, Stefan",,"=""""","=""""",0,4.06,,Kindle Edition,,2020,,,2021/08/17,to-read,to-read (#44),to-read,,,,0,,,0,,,,,
55554018,Pandas in Action,Boris Paskhaver,"Paskhaver, Boris",,"=""1617297437""","=""9781617297434""",0,0.0,Manning,Paperback,440,2021,,,2021/08/15,to-read,to-read (#43),to-read,,,,0,,,0,,,,,
43506164,"Practical Deep Learning for Cloud, Mobile, and Edge: Real-World AI & Computer-Vision Projects Using Python, Keras & Tensorflow",Anirudh Koul,"Koul, Anirudh","Siddha Ganju, Meher Kasam","=""149203486X""","=""9781492034865""",0,4.72,O'Reilly Media,Paperback,620,2019,,,2021/08/14,to-read,to-read (#42),to-read,,,,0,,,0,,,,,
50204679,Tinyml: Machine Learning with Tensorflow Lite on Arduino and Ultra-Low-Power Microcontrollers,Pete Warden,"Warden, Pete",Daniel Situnayake,"=""1492052043""","=""9781492052043""",0,4.46,O'Reilly Media,Paperback,504,2019,,,2021/08/08,to-read,to-read (#41),to-read,,,,0,,,0,,,,,
48816582,Practical Natural Language Processing: A Comprehensive Guide to Building Real-world NLP systems,Sowmya Vajjala,"Vajjala, Sowmya","Bodhisattwa Majumder, Anuj Gupta, Harshit Surana","=""1492054054""","=""9781492054054""",0,4.10,O'Reilly Media,Paperback,456,2020,,,2021/08/08,to-read,to-read (#40),to-read,,,,0,,,0,,,,,
41881472,The Psychology of Money,Morgan Housel,"Housel, Morgan",,"=""""","=""""",0,4.38,Harriman House,Paperback,252,2020,2020,,2021/08/08,to-read,to-read (#39),to-read,,,,0,,,0,,,,,
51163446,Building Machine Learning Pipelines: Automating Model Life Cycles with Tensorflow,Hannes Hapke,"Hapke, Hannes",Catherine Nelson,"=""1492053198""","=""9781492053194""",0,3.69,O'Reilly Media,Paperback,366,2020,,,2021/08/08,to-read,to-read (#38),to-read,,,,0,,,0,,,,,
37761872,Natural Language Processing in Action,Hobson Lane,"Lane, Hobson","Cole Howard, Hannes Hapke","=""1617294632""","=""9781617294631""",0,4.07,Manning Publications,Paperback,544,2019,,,2021/08/06,to-read,to-read (#37),to-read,,,,0,,,0,,,,,
54968118,"The Code Breaker: Jennifer Doudna, Gene Editing, and the Future of the Human Race",Walter Isaacson,"Isaacson, Walter",,"=""1982115858""","=""9781982115852""",0,4.35,Simon  Schuster,Hardcover,536,2021,2021,,2021/08/06,to-read,to-read (#36),to-read,,,,0,,,0,,,,,
55275944,Machine Learning Engineering,Andriy Burkov,"Burkov, Andriy",,"=""""","=""""",0,4.24,,Kindle Edition,,2020,,,2021/08/06,to-read,to-read (#35),to-read,,,,0,,,0,,,,,
50705179,Numbers Don't Lie: 71 Things You Need to Know About the World,Vaclav Smil,"Smil, Vaclav",,"=""0241454417""","=""9780241454411""",0,3.88,Viking,Hardcover,384,2020,2020,,2021/08/05,to-read,to-read (#34),to-read,,,,0,,,0,,,,,
26535513,Storytelling with Data: A Data Visualization Guide for Business Professionals,Cole Nussbaumer Knaflic,"Knaflic, Cole Nussbaumer",,"=""1119002257""","=""9781119002253""",0,4.40,Wiley,Paperback,288,2015,2015,,2021/08/02,to-read,to-read (#33),to-read,,,,0,,,0,,,,,
25366604,"The Neurogenesis Diet and Lifestyle: Upgrade Your Brain, Upgrade Your Life",Brant Cortright,"Cortright, Brant",,"=""""","=""""",0,4.23,Psyche Media,Kindle Edition,294,2015,2015,,2021/07/29,to-read,to-read (#32),to-read,,,,0,,,0,,,,,
52160040,"Advanced Deep Learning with TensorFlow 2 and Keras: Apply DL, GANs, VAEs, deep RL, unsupervised learning, object detection and segmentation, and more, 2nd Edition",Rowel Atienza,"Atienza, Rowel",,"=""""","=""9781838821654""",0,4.50,,kindle_edition,,2020,,,2021/07/27,currently-reading,currently-reading (#7),currently-reading,,,,1,,,0,,,,,
38242135,"AI Superpowers: China, Silicon Valley, and the New World Order",Kai-Fu Lee,"Lee, Kai-Fu",,"=""132854639X""","=""9781328546395""",4,4.11,Mariner Books,Hardcover,255,2018,2018,2021/07/28,2021/06/26,,,read,"First few chapters are quite insightful. The last few focus on conjecturing about the future. However, it is too filled with the author's bias view",,,1,,,0,,,,,
51278619,Hands-On Computer Vision with TensorFlow 2: Leverage deep learning to create powerful image processing apps with TensorFlow 2.0 and Keras,Benjamin Planche,"Planche, Benjamin",Eliot Andres,"=""""","=""""",0,4.50,Packt Publishing,Kindle Edition,372,2019,,,2021/07/27,to-read,to-read (#31),to-read,,,,0,,,0,,,,,
40717503,Generative Adversarial Networks Projects: Build next-generation generative models using TensorFlow and Keras,Kailash Ahirwar,"Ahirwar, Kailash",,"=""""","=""""",1,3.00,Packt Publishing,Kindle Edition,316,2019,,,2021/07/26,,,read,"I don't see the point of this book. If it was to show the theory behind, then the book just threw a bunch of concept together without explaining how they work, when to use them, etc. If it is to show how to code these projects, then the code level is very poor. A prime example is chapter 3, where the load_images function is obviously poorly constructed, leading to hours of waste time running that 1 function. A number of issue has been mentioned on github, but the author is unresponsive. It seems like the author himself has given up on this",,,1,,,0,,,,,
30741739,Machine Learning Yearning,Andrew Ng,"Ng, Andrew",,"=""""","=""""",0,4.30,,ebook,118,,,,2021/07/23,to-read,to-read (#30),to-read,,,,0,,,0,,,,,
37773354,"Deep Reinforcement Learning Hands-On: Apply modern RL methods, with deep Q-networks, value iteration, policy gradients, TRPO, AlphaGo Zero and more",Maxim Lapan,"Lapan, Maxim",,"=""""","=""""",0,4.32,Packt Publishing,Kindle Edition,546,2018,,,2021/07/17,to-read,to-read (#29),to-read,,,,0,,,0,,,,,
50075895,Deep Reinforcement Learning in Action,Alexander Zai,"Zai, Alexander",Brandon Brown,"=""1617295434""","=""9781617295430""",0,4.20,Manning,Paperback,325,2020,,,2021/07/17,to-read,to-read (#28),to-read,,,,0,,,0,,,,,
55275019,"Machine Learning Design Patterns: Solutions to Common Challenges in Data Preparation, Model Building, and MLOps",Valliappa Lakshmanan,"Lakshmanan, Valliappa","Sara Robinson, Michael Munn","=""1098115783""","=""9781098115784""",0,4.21,O'Reilly Media,Paperback,400,2020,,,2021/07/17,to-read,to-read (#27),to-read,,,,0,,,0,,,,,
55624521,Dive into Deep Learning,Aston Zhang,"Zhang, Aston","Zachary C. Lipton, Mu Li, Alexander J. Smola","=""""","=""""",0,4.38,,ebook,979,2020,,,2021/07/15,currently-reading,currently-reading (#6),currently-reading,,,,1,,,0,,,,,
36703132,Advances in Financial Machine Learning,Marcos López de Prado,"Prado, Marcos López de",,"=""1119482119""","=""9781119482116""",0,4.19,Wiley,ebook,400,2018,2018,,2021/07/09,to-read,to-read (#26),to-read,,,,0,,,0,,,,,
25752783,Web Scraping with Python: Collecting Data from the Modern Web,Ryan Mitchell,"Mitchell, Ryan",,"=""""","=""""",0,4.21,O'Reilly Media,Kindle Edition,256,2015,2015,,2021/07/09,to-read,to-read (#25),to-read,,,,0,,,0,,,,,
44144492,"Generative Deep Learning: Teaching Machines to Paint, Write, Compose, and Play",David        Foster,"Foster, David",,"=""1492041947""","=""9781492041948""",3,4.26,O'Reilly Media,Paperback,330,2019,,,2021/07/08,,,read,"I would definitely rate this book higher once the code base is documented. Overall, the concept explained is done very well. However, the level of details, and shall I say effort, are not the same in the latter part of the book. Especially for the generating music chapter. I understand that the book goes over quickly on a few part, otherwise it would be a few hundred of pages more ( I wouldn't mind that at all, considering how well the author explains the concept when he tries to do so). But some parts are just very difficult to understand without the proper documentation of the code, and any explanation in the book. I hope the author will start commenting his code on git hub soon enough, allowing for more readers to have a clearer understanding of what is going on under the hood",,,1,,,0,,,,,
48930266,Seven and a Half Lessons About the Brain,Lisa Feldman Barrett,"Barrett, Lisa Feldman",,"=""0358157145""","=""9780358157144""",0,4.09,Mariner Books,Hardcover,192,2020,2020,,2021/07/08,to-read,to-read (#24),to-read,,,,0,,,0,,,,,
50204636,Building Machine Learning Powered Applications: Going from Idea to Product,Emmanuel Ameisen,"Ameisen, Emmanuel",,"=""149204511X""","=""9781492045113""",0,4.27,O'Reilly Media,Paperback,256,2020,,,2021/07/08,to-read,to-read (#23),to-read,,,,0,,,0,,,,,
33357752,Spanish Short Stories For Intermediate Learners: 8 Unconventional Short Stories to Grow Your Vocabulary and Learn Spanish the Fun Way!,Olly Richards,"Richards, Olly",,"=""""","=""""",5,4.22,,Kindle Edition,217,2016,,2021/06/30,2021/06/29,,,read,very enjoyable read. help expand my vocabulary by a lot,,,2,,,0,,,,,
28186015,Weapons of Math Destruction: How Big Data Increases Inequality and Threatens Democracy,Cathy O'Neil,"O'Neil, Cathy",,"=""0553418815""","=""9780553418811""",3,3.88,Crown,Hardcover,259,2016,2016,,2021/04/24,,,read,"First part was interesting. Afterward it was rather repetitive. The author focuses too much on touching on as many area as possible, rather than giving convincing argument. Some points are poorly made, and it is quite clear that the author has limited knowledge on these topics",,,1,,,0,,,,,
52661559,Build a Career in Data Science,Emily  Robinson,"Robinson, Emily",Jacqueline Nolis,"=""1617296244""","=""9781617296246""",0,4.47,MEAP,Hardcover,250,2020,,,2021/06/26,to-read,to-read (#22),to-read,,,,0,,,0,,,,,
20696006,Being Mortal: Medicine and What Matters in the End,Atul Gawande,"Gawande, Atul",,"=""0805095152""","=""9780805095159""",5,4.43,Metropolitan Books,Hardcover,282,2014,2014,,2021/06/26,,,read,,,,1,,,0,,,,,
41724711,Deep Learning for Computer Vision with Python — Practitioner Bundle,Adrian Rosebrock,"Rosebrock, Adrian",,"=""""","=""""",2,4.41,,ebook,280,2017,,,2021/06/17,,,read,"substantially worse. I fail to see the point of this second book. a lot of topics introduced, such as image augmentation and transfer learning  are rather simple.  The book fails to actually go to more advance topic. Instead, it just introduces different architecture for CNN, while introducing these differences in a very shallow way. The part on different optimization, he literally throw in there 4-5 new optimization, without really showing the difference in performance",,,1,,,0,,,,,
37846923,Deep Learning for Computer Vision with Python — Starter Bundle,Adrian Rosebrock,"Rosebrock, Adrian",,"=""""","=""""",4,4.34,,ebook,330,2017,2017,2021/06/14,2021/06/14,,,read,,,,1,,,0,,,,,
148009,"The Elements of Statistical Learning: Data Mining, Inference, and Prediction",Trevor Hastie,"Hastie, Trevor","Robert Tibshirani, Jerome Friedman","=""0387952845""","=""9780387952840""",0,4.41,Springer,Hardcover,533,2003,2001,,2021/05/28,to-read,to-read (#21),to-read,,,,0,,,0,,,,,
27276428,The Gene: An Intimate History,Siddhartha Mukherjee,"Mukherjee, Siddhartha",,"=""""","=""""",0,4.32,Scribner,Hardcover,592,2016,2016,,2021/05/09,to-read,to-read (#20),to-read,,,,0,,,0,,,,,
23463279,Designing Data-Intensive Applications,Martin Kleppmann,"Kleppmann, Martin",,"=""""","=""""",0,4.72,O'Reilly,ebook,562,,2015,,2021/05/09,to-read,to-read (#19),to-read,,,,0,,,0,,,,,
22091581,Traction: A Startup Guide to Getting Customers,Gabriel Weinberg,"Weinberg, Gabriel",Justin Mares,"=""0976339609""","=""9780976339601""",3,4.09,S-curve Publishing,Hardcover,288,2014,2014,2021/05/03,2021/03/11,,,read,,,,1,,,0,,,,,
44525305,The Ride of a Lifetime: Lessons Learned from 15 Years as CEO of the Walt Disney Company,Robert Iger,"Iger, Robert",Joel Lovell,"=""""","=""""",5,4.38,Random House,Hardcover,272,2019,2019,2021/05/03,2021/04/15,,,read,,,,1,,,0,,,,,
411722,All of Statistics: A Concise Course in Statistical Inference,Larry Wasserman,"Wasserman, Larry",,"=""0387402721""","=""9780387402727""",0,4.21,Springer,Hardcover,442,2004,2003,,2021/04/23,currently-reading,currently-reading (#5),currently-reading,,,,1,,,0,,,,,
19148900,Understanding Machine Learning,Shai Shalev-Shwartz,"Shalev-Shwartz, Shai",Shai Ben-David,"=""1107057132""","=""9781107057135""",0,4.25,Cambridge University Press,Hardcover,410,2014,2014,,2021/04/20,to-read,to-read (#18),to-read,,,,0,,,0,,,,,
14744694,Python for Data Analysis,Wes McKinney,"McKinney, Wes",,"=""1449319793""","=""9781449319793""",4,4.14,O'Reilly Media,Paperback,400,2012,2011,,2021/04/20,,,read,,,,1,,,0,,,,,
44573628,Super Pumped: The Battle for Uber,Mike Isaac,"Isaac, Mike",,"=""0393652246""","=""9780393652246""",0,4.11,W. W. Norton  Company,Hardcover,387,2019,2019,,2021/04/15,to-read,to-read (#17),to-read,,,,0,,,0,,,,,
11865558,Venture Deals,Brad Feld,"Feld, Brad",Jason Mendelson,"=""0470929820""","=""9780470929827""",0,4.07,John Wiley & Sons,Hardcover,219,2011,2011,,2021/04/01,to-read,to-read (#16),to-read,,,,0,,,0,,,,,
56668328,"The Bomber Mafia: A Dream, a Temptation, and the Longest Night of the Second World War",Malcolm Gladwell,"Gladwell, Malcolm",,"=""0316296619""","=""9780316296618""",0,4.06,"Little, Brown and Company",Hardcover,256,2021,2021,,2021/03/30,to-read,to-read (#15),to-read,,,,0,,,0,,,,,
50748232,The Innovation Stack: Building an Unbeatable Business One Crazy Idea at a Time,Jim McKelvey,"McKelvey, Jim",,"=""0593086732""","=""9780593086735""",0,4.22,Portfolio,Hardcover,288,2020,,,2021/03/29,to-read,to-read (#14),to-read,,,,0,,,0,,,,,
12609433,The Power of Habit: Why We Do What We Do in Life and Business,Charles Duhigg,"Duhigg, Charles",,"=""1400069289""","=""9781400069286""",0,4.11,Random House,Hardcover,375,2012,2012,,2021/03/11,to-read,to-read (#13),to-read,,,,0,,,0,,,,,
36607149,Explosive Growth: A Few Things I Learned While Growing To 100 Million Users - And Losing $78 Million,Cliff Lerner,"Lerner, Cliff",,"=""""","=""""",4,4.24,Clifford Ventures Corporation,Kindle Edition,314,2017,2017,2021/03/10,2021/01/19,,,read,,,,1,,,0,,,,,
26270488,"Lessons in Corporate Finance: A Case Studies Approach to Financial Tools, Financial Policies, and Valuation",Paul Asquith,"Asquith, Paul",Lawrence A. Weiss,"=""111920741X""","=""9781119207412""",0,4.53,Wiley,Hardcover,496,2016,2016,,2021/03/08,to-read,to-read (#12),to-read,,,,0,,,0,,,,,
6289283,"Born to Run: A Hidden Tribe, Superathletes, and the Greatest Race the World Has Never Seen",Christopher McDougall,"McDougall, Christopher",,"=""""","=""""",0,4.29,Knopf,Hardcover,287,2009,2009,,2021/02/24,to-read,to-read (#11),to-read,,,,0,,,0,,,,,
17986418,Naked Statistics: Stripping the Dread from the Data,Charles Wheelan,"Wheelan, Charles",,"=""039334777X""","=""9780393347777""",4,3.94,W. W. Norton  Company,Paperback,304,2014,2012,,2021/02/21,,,read,,,,1,,,0,,,,,
22668729,Hooked: How to Build Habit-Forming Products,Nir   Eyal,"Eyal, Nir",,"=""1591847788""","=""9781591847786""",4,4.09,Portfolio,Hardcover,256,2014,2013,,2021/02/21,,,read,,,,1,,,0,,,,,
26457146,Python Data Science Handbook: Tools and Techniques for Developers,Jake Vanderplas,"Vanderplas, Jake",,"=""1491912057""","=""9781491912058""",0,4.31,O'Reilly Media,Paperback,500,2016,2016,,2021/02/07,to-read,to-read (#10),to-read,,,,0,,,0,,,,,
18176747,The Hard Thing About Hard Things: Building a Business When There Are No Easy Answers,Ben Horowitz,"Horowitz, Ben",,"=""0062273205""","=""9780062273208""",4,4.23,Harper Business,Hardcover,304,2014,2014,2021/01/22,2020/09/09,,,read,,,,1,,,0,,,,,
35249663,Inspired: How to Create Tech Products Customers Love,Marty Cagan,"Cagan, Marty",,"=""1119387507""","=""9781119387503""",0,4.23,Wiley,Hardcover,349,2017,2008,,2020/12/18,to-read,to-read (#9),to-read,,,,0,,,0,,,,,
51070490,"Ready, Set, Growth hack: A beginners guide to growth hacking success",Nader Sabry,"Sabry, Nader",,"=""""","=""""",0,4.89,,Kindle Edition,177,2020,,,2020/12/07,to-read,to-read (#8),to-read,,,,0,,,0,,,,,
31625067,Hacking Growth: How Today's Fastest-Growing Companies Drive Breakout Success,Sean     Ellis,"Ellis, Sean",Morgan  Brown,"=""045149721X""","=""9780451497215""",5,4.06,Currency,Hardcover,320,2017,2017,2020/12/05,2020/09/24,,,read,,,,2,,,0,,,,,
6912295,Viral Loop,Adam L. Penenberg,"Penenberg, Adam L.",,"=""0340994967""","=""9780340994962""",0,3.64,Hyperion Books,Paperback,274,2009,2009,,2020/11/24,currently-reading,currently-reading (#4),currently-reading,,,,1,,,0,,,,,
1864850,Learning SQL,Alan Beaulieu,"Beaulieu, Alan",,"=""0596007272""","=""9780596007270""",3,3.91,O'Reilly Media,Paperback,289,2005,2005,2020/11/18,2020/11/18,,,read,"Good beginner guide. However, for a beginner guide, more exercises would have been very beneficial",,,1,,,0,,,,,
49099937,No Rules Rules: Netflix and the Culture of Reinvention,Reed Hastings,"Hastings, Reed",Erin Meyer,"=""0593152387""","=""9780593152386""",0,4.33,Random House Large Print Publishing,Paperback,464,2020,2020,,2020/10/22,to-read,to-read (#7),to-read,,,,0,,,0,,,,,
48930275,How I Built This: The Unexpected Paths to Success from the World’s Most Inspiring Entrepreneurs,Guy Raz,"Raz, Guy",,"=""0358216761""","=""9780358216766""",5,4.23,Mariner Books,Hardcover,320,2020,,2020/10/22,2020/10/22,,,read,"Very well written book. As someone who has just started his own business, this book helps me reflecting on my current path, what I need, what I could do better, and most importantly, why am I pursuing this path",,,1,,,0,,,,,
840,The Design of Everyday Things,Donald A. Norman,"Norman, Donald A.",,"=""0465067107""","=""9780465067107""",5,4.13,Basic Books,Paperback,240,2002,1988,2020/10/08,2020/09/22,,,read,,,,1,,,0,,,,,
25814544,Sprint: How to Solve Big Problems and Test New Ideas in Just Five Days,Jake Knapp,"Knapp, Jake","John Zeratsky, Brad Kowitz","=""""","=""9781501121746""",0,4.19,Simon  Schuster,Hardcover,274,2016,2016,,2020/09/24,to-read,to-read (#6),to-read,,,,0,,,0,,,,,
45166937,"Obviously Awesome: How to Nail Product Positioning so Customers Get It, Buy It, Love It",April Dunford,"Dunford, April",,"=""""","=""""",0,4.31,Ambient Press,Kindle Edition,,2019,,,2020/09/24,to-read,to-read (#5),to-read,,,,0,,,0,,,,,
6018080,The Complete Cosmicomics,Italo Calvino,"Calvino, Italo","Martin L. McLaughlin, Jefferson Mays, Tim Parks, William Weaver","=""1846141656""","=""9781846141652""",4,4.18,Penguin Books,Hardcover,402,2009,1997,2019/11/21,2019/01/24,,,read,,,,1,,,0,,,,,
18050143,"Zero to One: Notes on Startups, or How to Build the Future",Peter Thiel,"Thiel, Peter",Blake  Masters,"=""0804139296""","=""9780804139298""",5,4.17,Crown Business,Hardcover,195,2014,2014,2020/07/26,2017/10/26,,,read,,,,1,,,0,,,,,
17660462,The Everything Store: Jeff Bezos and the Age of Amazon,Brad Stone,"Stone, Brad",,"=""0316219266""","=""9780316219266""",5,4.11,"Little, Brown and Company",Hardcover,384,2013,2013,,2020/09/08,,,read,,,,1,,,0,,,,,
21413662,What If? Serious Scientific Answers to Absurd Hypothetical Questions,Randall Munroe,"Munroe, Randall",,"=""0544272994""","=""9780544272996""",0,4.12,Mariner Books,Hardcover,303,2014,2014,,2020/07/14,currently-reading,currently-reading (#3),currently-reading,,,,1,,,0,,,,,
40277241,Brief Answers to the Big Questions,Stephen Hawking,"Hawking, Stephen",,"=""1984819194""","=""9781984819192""",5,4.30,Bantam,Hardcover,256,2018,2018,2020/07/13,2020/07/04,,,read,,,,2,,,0,,,,,
37638098,Creative Selection: Inside Apple's Design Process During the Golden Age of Steve Jobs,Ken Kocienda,"Kocienda, Ken",,"=""1250194466""","=""9781250194466""",5,4.05,St. Martin's Press,Hardcover,264,2018,2018,2020/07/08,2020/05/31,,,read,,,,1,,,0,,,,,
15056959,Case Interview Secrets: A Former McKinsey Interviewer Reveals How to Get Multiple Job Offers in Consulting,Victor Cheng,"Cheng, Victor",,"=""0984183523""","=""9780984183524""",5,4.14,Innovation Press,Paperback,292,2012,2012,2020/06/03,2020/06/03,,,read,,,,1,,,0,,,,,
35696171,"Enlightenment Now: The Case for Reason, Science, Humanism, and Progress",Steven Pinker,"Pinker, Steven",,"=""0525427570""","=""9780525427575""",5,4.22,Viking,Hardcover,576,2018,2018,2020/06/02,2020/04/29,,,read,,,,1,,,0,,,,,
39074550,Humble Pi: A Comedy of Maths Errors,Matt    Parker,"Parker, Matt",,"=""0241360196""","=""9780241360194""",5,4.12,Allen Lane,Paperback,314,2019,2019,,2020/06/01,,,read,,,,1,,,0,,,,,
34684622,Leonardo da Vinci,Walter Isaacson,"Isaacson, Walter",,"=""1501139150""","=""9781501139154""",0,4.13,Simon & Schuster,Hardcover,600,2017,2017,,2020/04/09,to-read,to-read (#3),to-read,,,,0,,,0,,,,,
12035933,Accounts Demystified: The Astonishingly Simple Guide to Accounting,Anthony Rice,"Rice, Anthony",,"=""0273744704""","=""9780273744702""",3,3.87,Pearson,Paperback,261,2011,2003,2020/03/31,2020/03/31,,,read,"Although the conversation writing method in the book makes it simpler to follow in most part, a lot of time, however, it makes the information fragmented and hard to follow",,,1,,,0,,,,,
76865,Good to Great: Why Some Companies Make the Leap... and Others Don't,James C. Collins,"Collins, James C.",,"=""0066620996""","=""9780066620992""",4,4.12,Harper Business,Hardcover,300,2001,2001,2020/03/22,2020/03/22,,,read,"Good book. I don't agree with all the example since some feel forced. For instance, the example with the Vietnamese war and the use of M16. They use M16 because that what they can get their hands on, not a matter of choice<br/>",,,1,,,0,,,,,
